{
  "format": "jarvis.integration-lock/2",
  "mission": "FUSION-02/U",
  "observed_at": "2026-10-25T22:25:35Z",
  "baseline_sha256": "145ecec0bd2ca24bd92ce244359b6f8b23c2ddb393d6e40fc7730469f5a0bf6f",
  "status": "BLOCKED",
  "components": [
    {
      "id": "core",
      "repository": "bubth720/JAVIS-Local-v2",
      "owner": "core",
      "primary": {
        "branch": "feat/fusion-01-core-integration",
        "commit": "36761cea101b5f88b87cd4136dc075d28a1adb96",
        "parents": [
          "0d41e6f3f412386371a81fe0d1a862fc87ae22cf"
        ],
        "files": [
          {
            "path": "AGENTS.md",
            "sha256": "d832c83e458720a0e19450a8fd6595460378b707bdc1d094e2e5c13c171465eb"
          },
          {
            "path": "README.md",
            "sha256": "91b13afaf897faec74d347a58b03607bb9489e780ddf27be567b68b84a628b4a"
          },
          {
            "path": "app/build.gradle.kts",
            "sha256": "be358aa8ded614ff4b21053835c278f864b9a64a808cfb828e3a255068ebcefa"
          },
          {
            "path": "build.gradle.kts",
            "sha256": "50425357e4449207a6e3098fa4f4dc66864a870859025051fc809589ddb858df"
          },
          {
            "path": "settings.gradle.kts",
            "sha256": "2d895395ecb9cd468e3afda7a610ee1a6c3270e4d1c1313e723792779dd323fb"
          },
          {
            "path": "docs/intensive-2026-10-22/CORE03-SOURCES.json",
            "sha256": "9b5648dc8ba322ec152cfda902d0ff3eb245d833a7d6a6d5369416fc2f985890"
          },
          {
            "path": "integration-lab/build.gradle.kts",
            "sha256": "208cd095ce3db2f237842c2a716238d87bc6d6cb4b915977fbc2cd477b04c6ed"
          },
          {
            "path": "integration-lab/src/main/kotlin/com/stark/jarvislocal/integrations/DocumentToolWorkflow.kt",
            "sha256": "24a85559b931ec056196191a7cdfc579b67a2d192002ed3e81fd9599cb3c7fb8"
          },
          {
            "path": "integration-lab/src/main/kotlin/com/stark/jarvislocal/integrations/WorkflowReceipts.kt",
            "sha256": "c2772b57ddbeb63927ca4c7c1e1137d564d9a204230951e23fd9595a7ab7e6cf"
          },
          {
            "path": "integration-lab/src/main/kotlin/com/stark/jarvislocal/integrations/ServicesToolAdapter.kt",
            "sha256": "1423846dfb6708a74100cd90334ef73648623367e5618da20fcb0945718509ed"
          },
          {
            "path": "integration-lab/src/main/kotlin/com/stark/jarvislocal/integrations/NexusSearchAdapter.kt",
            "sha256": "e1e7cc6c3c135bc630f906e291d6bb2cd3fe0e23f08213a187de6430fa0500ba"
          },
          {
            "path": "docs/fusion-01/REPORT.md",
            "sha256": "11e6014038de3b580e7c0dde66d459c1f798dd697c8ab1c76eb63095c18a6573"
          },
          {
            "path": "docs/fusion-01/RESULTS.json",
            "sha256": "e6d869495cb91cb6d87fca69eeb3fcd695c4513f853f0f146417800f6c27323d"
          },
          {
            "path": "docs/fusion-01/COMPATIBILITY.md",
            "sha256": "4eecb05be4dae1c67c841899136c24708adbbb0d2c17b47003ab7826e3d9814a"
          },
          {
            "path": ".github/workflows/fusion-01-core.yml",
            "sha256": "6fff08f5ad49478a8ec6880c0b2e90431df089d4e3ce8db226598117f63b3f03"
          },
          {
            "path": "app/src/main/java/com/stark/jarvislocal/LocalDatabase.kt",
            "sha256": "2e8fa2c8eea6b793081bf47b0f9c86b78266df980e4435e2e7381f5561768804"
          },
          {
            "path": "app/src/main/java/com/stark/jarvislocal/memory/ConfirmedMemoryStore.kt",
            "sha256": "5545e25d494119d71c745aaebda96837c6edf76db1fc7d84bb207d9be3495e7d"
          }
        ]
      },
      "alternatives": [
        {
          "branch": "feat/mem-02-intensive",
          "commit": "49ad428e94edd75c2a1d115c8c2504f26609eace",
          "parents": [
            "283423cb8b9d567539f33cf7f2f1fafa602cf974"
          ],
          "files": [
            {
              "path": "README.md",
              "sha256": "91b13afaf897faec74d347a58b03607bb9489e780ddf27be567b68b84a628b4a"
            },
            {
              "path": "AGENTS.md",
              "sha256": "888818edae65551a68f94cf0f122874b6d1d76b7f9c991cd95d9b73ba0442c08"
            },
            {
              "path": "build.gradle.kts",
              "sha256": "50425357e4449207a6e3098fa4f4dc66864a870859025051fc809589ddb858df"
            },
            {
              "path": "settings.gradle.kts",
              "sha256": "2d895395ecb9cd468e3afda7a610ee1a6c3270e4d1c1313e723792779dd323fb"
            },
            {
              "path": "app/build.gradle.kts",
              "sha256": "be358aa8ded614ff4b21053835c278f864b9a64a808cfb828e3a255068ebcefa"
            },
            {
              "path": "docs/intensive-2026-10-22/VALIDATION-MEM-02.json",
              "sha256": "5cf786bcf731363dad6591d5e7f9d3dcccee036769e41b667b31ef9af3dc4968"
            }
          ]
        },
        {
          "branch": "feat/id-02-intensive",
          "commit": "283423cb8b9d567539f33cf7f2f1fafa602cf974",
          "parents": [
            "7a54f85adc5143bf8c7710de81942d49f3b901d0"
          ],
          "files": [
            {
              "path": "README.md",
              "sha256": "91b13afaf897faec74d347a58b03607bb9489e780ddf27be567b68b84a628b4a"
            },
            {
              "path": "AGENTS.md",
              "sha256": "3d5416b061ea34b1bbd5d1f40011b152abf4c0d5f0e7c9507a80a8341601189d"
            },
            {
              "path": "build.gradle.kts",
              "sha256": "50425357e4449207a6e3098fa4f4dc66864a870859025051fc809589ddb858df"
            },
            {
              "path": "settings.gradle.kts",
              "sha256": "2d895395ecb9cd468e3afda7a610ee1a6c3270e4d1c1313e723792779dd323fb"
            },
            {
              "path": "app/build.gradle.kts",
              "sha256": "be358aa8ded614ff4b21053835c278f864b9a64a808cfb828e3a255068ebcefa"
            }
          ]
        },
        {
          "branch": "feat/core-voice-pilot",
          "commit": "7426665f2794cba83646008fa0f342d102141201",
          "parents": [
            "ee4a1bf3b8af9e07ed95d58040af248713ceb14c"
          ],
          "files": [
            {
              "path": "README.md",
              "sha256": "91b13afaf897faec74d347a58b03607bb9489e780ddf27be567b68b84a628b4a"
            },
            {
              "path": "AGENTS.md",
              "sha256": "b72ead6bc11e0b30d321396751901ac9de7167fc0cb91bbb2487df69dc38e46c"
            },
            {
              "path": "build.gradle.kts",
              "sha256": "50425357e4449207a6e3098fa4f4dc66864a870859025051fc809589ddb858df"
            },
            {
              "path": "settings.gradle.kts",
              "sha256": "1c62754deb03e601b3dc0041fa7471cb37338e127f22cbcc93a42b60506d2c68"
            },
            {
              "path": "app/build.gradle.kts",
              "sha256": "8f9baccff2e0b9c35d144e3bbf74b90bc279dbf54c2f9eda8012e156e5ccd369"
            }
          ]
        },
        {
          "branch": "feat/core-03-intensive",
          "commit": "aea5ac859ac551d54fe16187c1883a487dbee9d6",
          "parents": [
            "49ad428e94edd75c2a1d115c8c2504f26609eace"
          ],
          "files": [
            {
              "path": "README.md",
              "sha256": "91b13afaf897faec74d347a58b03607bb9489e780ddf27be567b68b84a628b4a"
            },
            {
              "path": "AGENTS.md",
              "sha256": "9634af41a7689876d50340edd10dcc084b7ded92beb3d4606f77fc44e1f2b373"
            },
            {
              "path": "build.gradle.kts",
              "sha256": "50425357e4449207a6e3098fa4f4dc66864a870859025051fc809589ddb858df"
            },
            {
              "path": "settings.gradle.kts",
              "sha256": "2d895395ecb9cd468e3afda7a610ee1a6c3270e4d1c1313e723792779dd323fb"
            },
            {
              "path": "app/build.gradle.kts",
              "sha256": "be358aa8ded614ff4b21053835c278f864b9a64a808cfb828e3a255068ebcefa"
            },
            {
              "path": "integration-lab/src/main/kotlin/com/stark/jarvislocal/integrations/NexusSearchAdapter.kt",
              "sha256": "22a8acadabbdb7eda7aa828f5566c42f6b7affa484fdfb5b0b9f9abcef719de5"
            },
            {
              "path": "integration-lab/src/main/kotlin/com/stark/jarvislocal/integrations/ServicesToolAdapter.kt",
              "sha256": "6422a37754dc454eb587fc67c90466850ede6b46fd9fa542d6221681a2977fb0"
            },
            {
              "path": "integration-lab/build.gradle.kts",
              "sha256": "208cd095ce3db2f237842c2a716238d87bc6d6cb4b915977fbc2cd477b04c6ed"
            },
            {
              "path": "app/src/main/java/com/stark/jarvislocal/InferenceContract.kt",
              "sha256": "4588606d1f403fa04d770d1d7f51adb168efb7eb26c7fb98e1826dfda779b997"
            },
            {
              "path": "app/src/main/java/com/stark/jarvislocal/LlamaLocalEngine.kt",
              "sha256": "5cb8dc75c9cc17ded1d3ff3af5c7e53fc0b33dcd1c8efb0b1e1dcc45a7015ac2"
            },
            {
              "path": "app/src/main/java/com/stark/jarvislocal/SessionCoordinator.kt",
              "sha256": "6610fca9c2c4d3c1cef18c9f2521527468a3d81b99cfc4400958bfea768e0a50"
            },
            {
              "path": "docs/intensive-2026-10-22/REPORT-CORE-03.md",
              "sha256": "9aa6232782e3a74897b896a01fe85aea867969455631762e6e1ec258d6cc995d"
            },
            {
              "path": "docs/intensive-2026-10-22/VALIDATION-CORE-03.json",
              "sha256": "3f8f5743895d20d233f8d26cb307c5455b802320a8e268bf839fbd6b3f38c012"
            }
          ]
        },
        {
          "branch": "feat/core-02-intensive",
          "commit": "e86107b8213b0aeaf9d22025cf6bef91a8e544a5",
          "parents": [
            "b98bd1c4722cd053021d4021717b73ff595d5fed"
          ],